Id,Title,Description,ReleaseYear,AgeCertification,Runtime,Genres,ProductionCountry,Seasons
1,Eius debitis a.,Voluptas beatae ipsum vero sed voluptatum. Et vero placeat eligendi eos est. Aut deleniti sed mollitia aut recusandae saepe ducimus. Labore nulla provident omnis quasi. Nobis animi est accusamus facilis dolor reprehenderit voluptatem.,2011,18,55,Adventure;Action;Comedy;Horror;Fantasy;Sci-Fi;Thriller;Drama,SYR,
2,Autem asperiores voluptatum distinctio rerum et sint et.,Exercitationem rerum odit eum commodi distinctio eligendi dicta provident. Enim consequatur tempora hic laborum adipisci. Voluptas beatae illum. Enim doloremque omnis eligendi ut quae consequuntur amet voluptatum animi. Provident expedita quibusdam sed doloremque iure id eius ut. Quisquam repellendus occaecati fugit.,1930,18R,86,Mystery,IMN,
3,Porro nulla aut ea esse rerum aperiam exercitationem non.,Eaque culpa libero nihil optio. Ipsa repudiandae iusto a sunt. Est in molestias sed consequatur veritatis sed consequatur earum. At suscipit soluta atque qui. Molestias repellendus sed illo expedita corrupti dolor commodi.,1949,MA15+,80,Romance;Adventure;Fantasy;Drama,BHS,8
4,Maiores necessitatibus accusantium.,Sed cumque et. Ratione doloremque non non veritatis. Aperiam molestiae id in rerum quasi voluptatem. Est neque quo est. Ut omnis voluptate. Incidunt veniam est est at et.,1954,PG,245,Adventure;Drama;Mystery;Comedy;Action;Romance,COG,
5,Quis debitis eligendi tempora sint aperiam facere.,Aut aliquid sed. Maiores amet culpa et rerum repellat. Mollitia amet commodi iste quae nihil laborum ipsa laudantium et. Adipisci vitae hic explicabo voluptatibus eveniet possimus omnis. Similique architecto repellendus eligendi aut. Et laboriosam quod rem ad libero.,1984,18R,45,Adventure;Romance;Drama,ALA,
6,Voluptatem explicabo et enim.,Quo consequuntur consequuntur. Quas cum placeat. Numquam et id. Ex nulla sint omnis ab et explicabo.,1965,E,249,Sci-Fi;Mystery;Adventure;Thriller;Romance;Action,JAM,
7,Deleniti tempore voluptatem.,Quae eveniet non eum. Amet illo et eum tenetur ut suscipit. Natus distinctio nam in odit laborum nesciunt cumque tempore eligendi. Dolor est qui sit ipsam consequuntur quam quod. Eum velit cum nulla asperiores est qui. Rerum excepturi error non at.,1988,R,287,Thriller;Comedy;Drama;Romance;Mystery;Fantasy;Action,IND,
8,Deleniti cumque id numquam facilis corporis laboriosam qui.,Ut enim voluptate. Magnam accusamus aut. Aut reiciendis quia sequi consequatur reprehenderit officiis aliquam. Ducimus omnis omnis explicabo omnis id quod soluta.,1993,R18+,185,Drama;Mystery,TJK,
9,Et iure omnis eligendi.,Numquam omnis accusamus. Molestiae est non veniam laudantium eum laboriosam ullam odit ut. Voluptas consequuntur molestiae dignissimos fuga sed autem.,2019,PG,181,Adventure;Thriller;Horror;Fantasy;Drama,JAM,
10,Optio voluptates aliquam error deserunt ipsam.,Dolor illo earum omnis debitis eligendi qui eos quia. Repellat tempore aut ea quis dolorem. Atque illo totam. Officia neque quidem velit ducimus odit quod sapiente sunt.,1984,CA,188,Thriller;Romance;Horror;Adventure,IRN,
11,Error ab facere qui.,Vitae perferendis nulla. Aut corporis optio dolorum dolor non nihil. Autem magnam autem. Molestias aut temporibus. Excepturi et ducimus quisquam.,1973,MA15+,89,Adventure;Thriller;Comedy,STP,
12,Deserunt iusto eligendi eos.,Dolorem modi earum excepturi. Cumque vitae dignissimos saepe molestiae aut magnam voluptas sed. Fugiat dolores quia vel voluptas necessitatibus.,1927,TV-MA,113,Comedy;Drama;Sci-Fi;Fantasy;Horror;Adventure,KWT,
13,Unde alias et eaque hic.,Quisquam accusamus id ipsa consequatur voluptatibus in rerum sunt. Sapiente fugiat veniam dolor qui doloribus suscipit beatae occaecati nemo. Architecto nemo fugiat.,1909,R18+,253,Sci-Fi;Romance;Drama;Adventure;Horror;Action;Mystery;Comedy,SLE,
14,Reprehenderit fuga quisquam sed itaque eligendi accusamus.,Facere dolore est iure minima repudiandae officia dolore et. Ducimus molestiae quo similique fugiat voluptatem non. Et consequuntur quia.,1957,R,169,Sci-Fi;Action,PNG,
15,Error qui ut voluptas nihil incidunt blanditiis ut adipisci qui.,Delectus repellat placeat sit sed asperiores. Laudantium assumenda maxime error earum sunt autem eligendi illo est. Et quia quam non. Sunt iure rem ut similique sed sunt assumenda amet in. Sequi culpa dolores qui assumenda eum et eos non qui. Nihil deleniti tenetur repudiandae assumenda voluptas dignissimos magni voluptatibus debitis.,1984,9,64,Mystery;Romance;Adventure;Action;Fantasy;Comedy;Sci-Fi,TJK,7
16,Doloremque nihil ut pariatur numquam eos.,Officiis harum quod voluptatem aut quod omnis nesciunt. Qui id aut reiciendis cumque aliquam ut placeat. Neque est provident officiis laudantium culpa et. Id dolorum error. Qui veniam qui.,1986,M,50,Action;Romance;Adventure;Thriller;Sci-Fi;Horror;Fantasy,PCN,
17,Qui iste consequatur quasi ut molestiae.,Qui alias modi enim. Deleniti ipsa assumenda est dolorem ut voluptas voluptas. Et dignissimos harum aut quisquam est sequi quo cum vel.,1937,R16,239,Drama;Thriller;Horror,IRQ,
18,Aut quia officia quis.,Neque ipsa tempore est dolorum. Praesentium quidem est amet quisquam quisquam distinctio excepturi autem. Neque error eum. Odio aut nobis repellat magni aut non alias id rerum. Vero eaque et quo explicabo consequatur ex eos ipsum. Sit voluptatem nesciunt asperiores fuga omnis dolor non qui molestiae.,1977,A,278,Comedy;Sci-Fi;Adventure;Thriller;Horror;Action,ECU,
19,Repudiandae saepe dolorum est numquam enim magni modi voluptatem.,Adipisci quo ipsa sed qui voluptatem impedit dolor accusamus. Quaerat iure numquam aperiam accusantium ducimus doloremque ratione reprehenderit numquam. Ullam debitis ex. Omnis voluptas rerum dolorem beatae consectetur et occaecati non dolore.,1944,U/A,94,Horror;Drama;Mystery,JEY,2
20,Molestias omnis et recusandae.,Error vitae sit omnis dolorem tempore mollitia quasi id. Molestiae rerum neque sit voluptatem itaque cum omnis est non. Facere impedit assumenda eum iusto. Dolores eum officiis.,1944,EC,96,Fantasy;Sci-Fi;Thriller;Action;Drama;Romance;Adventure;Horror,ABW,
21,Perspiciatis quae quasi autem iste labore accusamus et pariatur quia.,Placeat aut deserunt voluptatem voluptas. Nostrum esse minus qui dolore maiores maiores vel. Nemo delectus qui dolorum est fugiat a aut.,1952,TV-Y7,247,Drama;Comedy;Horror,SMR,
22,Nisi incidunt consequatur eligendi iure.,Sit facere magnam qui rem voluptas adipisci minus. Dolorem libero earum ut recusandae optio in distinctio. Illum sint occaecati.,1980,E,215,Sci-Fi;Adventure;Mystery;Thriller;Horror;Comedy;Romance;Action,IDN,
23,Sit optio debitis natus.,Aut libero et illum et et eum voluptatibus sunt. Consectetur quod impedit et quia. Dolorem aut officiis voluptatibus et odio porro. Non voluptatem est eligendi consequatur deserunt qui qui vero doloremque. Blanditiis iusto aut et eum deserunt aut. Architecto corrupti vel beatae voluptatem vel minus.,1925,18,170,Thriller;Sci-Fi;Horror,MSR,
24,Et porro exercitationem molestiae.,Quam animi aut impedit molestias quod sunt quia. Sint itaque voluptatem. Ea ad sequi similique recusandae. Nobis consequatur animi quia sed. Sit et qui dolor. Quo delectus voluptas.,2001,TV-Y7,100,Fantasy;Action;Drama;Adventure;Thriller;Romance,SLV,
25,Sed earum sunt cum adipisci sed.,Fuga quidem voluptate omnis architecto et quis accusantium ut qui. Et aut omnis ab ad eos perferendis et quia nulla. Debitis nemo incidunt tenetur cupiditate porro.,1958,AL,212,Horror;Comedy;Action;Adventure;Fantasy;Sci-Fi;Romance,THA,
26,Tenetur quaerat sint ut qui et est maxime vitae.,Sint enim ab quam iste tenetur quos enim. Doloremque sit assumenda nesciunt eligendi atque quo est. Doloremque sit similique dolor. Quod et molestiae.,1906,X18,66,Action,SLV,1
27,Minima quasi distinctio ullam dolores iste qui veniam sed vel.,Aliquid qui quia iusto soluta molestias placeat. Ipsam quidem rem voluptas sit quas non. Perferendis voluptatibus dolores. Aut laborum est impedit doloremque deleniti velit consequatur mollitia. Rerum debitis beatae a atque impedit ullam quae delectus.,1945,M/PG,266,Romance;Fantasy;Drama;Mystery,BOL,5
28,Aspernatur magni recusandae et et aut dolor occaecati est neque.,Debitis reiciendis aut voluptas nulla id atque accusamus nulla. Excepturi quia autem quia est quia aliquam perferendis eligendi. Non tenetur quo sapiente id molestias enim aut est aliquid. Autem soluta laborum eveniet. Reiciendis eveniet dolor.,1915,S,269,Adventure;Horror;Comedy;Action;Fantasy;Mystery;Drama;Thriller,BEN,
29,Rerum consequatur iure.,Et animi aut pariatur. Architecto eligendi commodi quam suscipit ab. Praesentium dolorem excepturi quibusdam sed reiciendis similique eligendi autem eaque. Optio necessitatibus aliquam. Corporis consectetur eum tempora.,1989,R21,182,Thriller;Action;Horror;Mystery,COD,
30,Non quibusdam molestiae voluptas.,Sed eum ducimus non. Vel perspiciatis aut quis vel voluptate quas modi quaerat. Exercitationem facere non doloribus nulla reprehenderit quaerat possimus ut. Accusamus aut et esse officiis quidem id.,1903,18,57,Sci-Fi;Horror;Action;Fantasy;Mystery;Romance;Comedy;Thriller;Adventure;Drama,JOR,3
31,Rerum vero inventore.,Eos quos aperiam eveniet consequatur incidunt laborum et accusantium corrupti. Facilis labore nihil deserunt minus laudantium. Molestiae ad beatae dicta qui vitae quia et accusantium. Est similique voluptas provident officiis fuga voluptatem.,1960,U/A,32,Drama;Sci-Fi;Comedy;Horror,SGP,
32,Vero debitis eum beatae ullam laborum nemo iste quod reprehenderit.,Repellat saepe sint qui occaecati tempora. Et sunt et quisquam reprehenderit et eius. Quos unde mollitia sit dolores doloremque est nam tempora asperiores. Omnis dolorem expedita. Eum veritatis libero inventore quo numquam incidunt. Dolorem autem impedit minima et rerum quisquam.,1923,T,243,Horror;Comedy;Fantasy;Action;Romance;Thriller,NIU,
33,Provident repellendus dolores magni suscipit.,Sequi quis et. Molestiae quo similique qui accusamus facere alias. Ut provident laudantium sapiente quam qui architecto. Beatae mollitia est deleniti ut. Cumque aut asperiores perspiciatis facere sit laboriosam laborum adipisci.,1944,TV-G,114,Drama;Action,VGB,
34,Ex eveniet sequi nam dolores consequatur nesciunt veritatis adipisci unde.,Et modi rerum sit quam consequuntur ut illo. Ut numquam ratione. Qui nulla odit impedit. Cumque quis non et aliquid quia molestias tempora architecto dolores. Cum corrupti quasi et iusto aut est perferendis rerum illum. Sequi distinctio voluptas eos numquam.,1914,E10+,239,Sci-Fi;Thriller;Action;Comedy;Mystery;Horror;Romance;Drama,WLF,
35,Autem beatae quis ex nam doloribus.,Rem illo eaque quisquam rerum ut enim. Ad explicabo adipisci quis suscipit et quia natus qui numquam. Excepturi facilis quod vel dolores. Eligendi est incidunt dolor quos. Reiciendis velit dolores eveniet ipsam eos. Alias et rerum laboriosam est laboriosam dolorum dolores reprehenderit molestiae.,2013,6,116,Sci-Fi;Action,COD,6
36,Tenetur dolor inventore nesciunt maiores.,Debitis harum est molestias quibusdam a praesentium dolore voluptatem. Omnis ducimus eaque dicta qui amet eum non ut cumque. Qui a reprehenderit magnam. Molestiae cumque dolore laudantium laborum quis.,1980,U,291,Action;Adventure;Thriller,MWI,
37,Aut voluptas et.,Ut dolorem sint. Eaque voluptatem qui voluptatem ut nihil. Quam quis recusandae. Qui dolor quasi cumque nihil eius suscipit.,1975,M/PG,30,Mystery,GNQ,
38,Quae ipsam doloremque et culpa autem delectus unde enim ut.,Tempore similique at nostrum nihil expedita minima. Recusandae quaerat quod nemo. Dolores mollitia pariatur.,1985,M,290,Drama;Mystery;Thriller;Fantasy;Sci-Fi,CPV,
39,Eligendi fuga iure quia maxime asperiores atque deserunt.,Consectetur voluptatem dolor quaerat sed. Minima eveniet sit. Officia totam vel. Mollitia est aut.,1980,S,53,Action;Drama;Thriller,BIH,
40,Sint aperiam id officiis corrupti.,Ad fugit assumenda rem velit illo qui tempora. Sint vero id expedita dolorem facere aut. Vitae sequi accusamus quos rerum voluptatem nisi inventore.,1918,CA,70,Thriller;Comedy;Horror;Drama;Romance;Sci-Fi;Fantasy,OMN,
41,In aut est harum.,Libero id vel recusandae minus. Minus est ex atque corrupti rerum. Est nisi ipsum. Qui rerum est voluptatem tenetur. Nemo vitae qui suscipit. Ea facilis reprehenderit reprehenderit non et aperiam perferendis eum.,1921,12,151,Thriller;Action;Horror;Mystery,UKR,10
42,Voluptatibus possimus quo eius est cum quam et.,Omnis quibusdam sit eum blanditiis fugiat necessitatibus soluta hic. Ducimus enim corporis qui ratione qui ut excepturi omnis sequi. Pariatur dolores dolor eaque laboriosam enim aut velit rem optio.,1987,TV-G,106,Horror,ABW,
43,Aut eligendi ratione a.,Possimus explicabo cumque sunt harum commodi eaque. Accusamus exercitationem officia veniam ea et nostrum aspernatur. Facere praesentium magni. Omnis enim et quis consequuntur voluptatum id qui.,1964,15,65,Sci-Fi;Adventure;Fantasy;Thriller;Drama;Romance;Comedy;Mystery;Action;Horror,PRT,
44,Qui sed illum aut ex doloremque.,Delectus aspernatur velit inventore ipsa et id. Quia consectetur illo qui corrupti ut vero nihil aut corrupti. Omnis similique provident officia sit a molestiae. Enim est voluptas ipsa consequuntur perspiciatis est blanditiis et. Laborum cumque numquam vitae. Ex praesentium qui.,1908,18R,101,Comedy;Thriller;Sci-Fi;Mystery;Drama;Horror;Adventure;Romance;Action,PAK,
45,Laborum reiciendis sit vero animi esse fuga.,Soluta harum eveniet architecto perspiciatis illo ea unde aut quisquam. Praesentium unde consequatur. Consectetur possimus iste harum nulla architecto sunt ratione.,1966,6,290,Drama;Fantasy,SLE,
46,Ex libero velit maiores.,Voluptatem autem omnis ex quae. Repellat temporibus blanditiis molestiae exercitationem deleniti nulla nihil hic est. Omnis unde delectus. Molestiae ullam dolor doloribus consectetur itaque quae ab minus. Itaque et porro nam qui nostrum perferendis a. Error non ipsa iure adipisci error.,1908,AL,227,Action;Fantasy;Drama;Mystery;Comedy;Horror;Sci-Fi;Thriller,KIR,
47,Et veritatis qui quo nemo beatae aperiam officiis nostrum non.,Est excepturi asperiores libero quisquam voluptates animi distinctio voluptas magni. Nesciunt qui deserunt ut quia. Et non delectus cumque velit. Fuga optio optio eius.,1972,PG,186,Adventure;Thriller,LVA,
48,Est perspiciatis ea accusantium vero voluptas.,Autem non ex a. Vel cum minus aperiam. Voluptas aut minima ea quasi aliquam omnis cum doloribus. Nulla quae consectetur voluptatum.,1994,R16,115,Mystery;Drama;Fantasy;Horror;Comedy;Sci-Fi,IDN,
49,Eaque debitis quibusdam aliquid eos repellendus quis.,Dolorem aut velit et blanditiis. Est velit ea. Aut omnis totam et exercitationem ut possimus voluptatibus voluptas ullam. Dolores ut qui officia eum et sunt neque aliquid.,1961,PG,262,Fantasy;Thriller;Action;Adventure;Drama;Horror;Mystery,NIC,10
50,Aliquid sit voluptate.,Laborum vitae vel minima et. Saepe cum laudantium. Iusto cumque itaque quidem sunt quibusdam ea.,1944,M/PG,62,Horror;Fantasy,BRN,
51,Rerum consequatur voluptas asperiores.,Libero est et voluptas dolor. Quibusdam hic ullam dolor. Laboriosam eum ut id mollitia. Minima quae dolorum vel. Quam nisi quod vero nulla. Inventore ea earum quia odio dolores.,2020,S,78,Horror;Drama;Comedy;Action;Adventure;Romance,SSD,3
52,Nam ut et et voluptatum eaque ipsum velit dolorum rerum.,Debitis quis aut alias occaecati libero. Omnis distinctio iure eos quasi magni voluptatibus et autem vero. Voluptas molestiae aliquid. Laborum ut dolorem quas omnis dicta. Alias molestiae sunt laborum consequatur qui tempora. Mollitia eveniet asperiores quasi.,1955,U,205,Adventure;Comedy;Fantasy;Mystery;Drama;Horror;Action;Thriller,SVK,
53,Culpa ducimus esse veritatis sunt.,Eum dolores sed et consectetur harum excepturi veniam assumenda non. Laboriosam voluptatem autem quia neque. Aperiam voluptates officiis veniam exercitationem nihil ipsum consequatur voluptatem. Ratione odio enim perferendis dignissimos nemo molestiae ut sed aliquid. Quibusdam sed et cupiditate rerum rem ab.,1928,AL,191,Mystery;Romance;Action;Horror;Fantasy,BIH,
54,Culpa neque perspiciatis dignissimos quia molestiae saepe quis.,Asperiores tempore aperiam ex fuga dolores repudiandae tempore. Porro maxime ut dolorum dolor. Voluptatem ut inventore consequatur ut mollitia ipsam dolores necessitatibus ipsa.,1959,R16,178,Adventure;Mystery;Thriller;Drama;Fantasy;Horror;Comedy;Sci-Fi,HTI,
55,Iusto ipsum neque voluptatem voluptatem et temporibus cum.,Eum est iure ut. Non ut velit adipisci ducimus. Aut et aut dolor. Dolor esse et eos fugit libero vel voluptatum. Nam dolorem omnis ducimus assumenda amet sed fuga dolores. Nostrum quia voluptas cumque.,1993,12A,265,Action;Drama;Romance;Sci-Fi;Mystery;Thriller;Fantasy;Adventure,COD,
56,Veniam nihil aut culpa quia cupiditate.,Amet quaerat veritatis omnis eius consequatur. Voluptas velit voluptas soluta suscipit non at ex. Et alias dignissimos molestiae facere non modi dolor impedit. Ullam voluptas possimus quaerat. Quae iusto fugiat.,1988,TV-G,200,Fantasy;Comedy;Action;Romance;Mystery;Sci-Fi;Thriller,FRA,
57,Ipsam voluptatum eius eius maiores ullam rerum.,Quia dicta autem quos qui voluptatibus sunt aut officiis. Eos id commodi dolores. Nesciunt modi quod. Ut quasi rerum soluta nobis odit reiciendis voluptatem vero. Aliquam placeat praesentium.,2010,C,122,Thriller;Adventure;Mystery;Comedy;Romance;Sci-Fi,GHA,
58,Doloribus et tempore excepturi qui culpa voluptatum iste dolorem dolorem.,Id magnam assumenda occaecati voluptatem tempora nobis molestias corporis. Ab provident voluptate et molestiae deleniti libero nisi. Et et harum. Omnis est aut voluptas. Recusandae consequuntur omnis ut. Sint asperiores odio iste quaerat iste fugit amet sint.,1909,6,53,Comedy;Adventure;Horror;Fantasy;Sci-Fi;Action;Drama,NRU,
59,Soluta voluptatem rerum quod at quam distinctio ex quam hic.,Et ex qui sit modi magni aut maxime aut. Pariatur et dolores et sit sed rerum dolor adipisci repellendus. Inventore provident sed corporis aut dolor.,1959,12,144,Action;Adventure;Horror;Romance;Fantasy;Mystery;Drama;Sci-Fi;Comedy,MAC,
60,Quam error aliquam est.,Et qui quo esse illo provident optio quibusdam tempora delectus. Ut qui sint in earum ullam rerum. Voluptas quod sunt eos. Qui amet quia eveniet provident vel dolorem. Aliquam fugit inventore.,1948,R16,49,Romance;Sci-Fi;Comedy;Mystery;Thriller;Adventure,PRI,
61,Accusantium praesentium temporibus aspernatur saepe quas.,Ducimus non quas iure at quo rerum aut non perferendis. Nam accusantium quam. Unde vel nam labore cupiditate. Odio dolores illum ea at delectus placeat. Voluptatem est vel illo fugit. At sint perspiciatis odit quis quos.,1937,X18,85,Comedy;Horror;Thriller,JPN,
62,Rerum ipsam libero excepturi eligendi explicabo.,Necessitatibus explicabo dolor consequuntur et perspiciatis cumque adipisci nobis repudiandae. Ad est sit perspiciatis. Consequatur blanditiis magnam soluta est perspiciatis nisi voluptatem voluptatum. Ad et voluptatem odit dicta voluptate nihil et.,1910,X18,157,Action;Adventure;Mystery;Drama,DEU,7
63,Ratione fugit blanditiis ipsum.,Eum dolor quod est deserunt officia et delectus voluptatem aut. Voluptatem repudiandae dicta earum omnis optio. Error qui ullam.,1998,PG,179,Comedy;Adventure;Horror;Mystery;Thriller;Fantasy;Sci-Fi,TCA,
64,Quia veritatis quasi voluptas.,Saepe fugit consequatur molestias eius et tenetur. Facere praesentium fuga autem. Placeat velit quia accusantium sit repellendus sit. Nesciunt sunt odit doloribus hic.,1986,18,194,Thriller;Romance;Drama;Action;Fantasy,SRB,
65,Explicabo facere aspernatur quo voluptas nisi.,Qui nihil est aut nihil voluptas sunt praesentium in. Est saepe fugit eum doloremque aut ratione. Assumenda optio earum corrupti. Quia optio ea et minima enim.,1972,15,142,Sci-Fi;Fantasy;Mystery;Horror;Romance;Thriller,SVK,
66,Voluptatibus harum vel omnis aut iste error rerum.,Optio quia saepe eaque aut est qui beatae voluptatem nostrum. Modi illo aut. Molestias repellendus incidunt est adipisci voluptatem quidem reiciendis pariatur modi. Labore ut qui qui nemo. Assumenda quos occaecati necessitatibus voluptates tempore libero molestiae.,1902,TV-MA,128,Horror;Drama;Action;Comedy;Mystery;Fantasy;Sci-Fi;Adventure;Romance,LSO,
67,Voluptatibus aut dolorum dolore sed accusantium alias id.,Fugit sed corporis ex. Id consequatur ab alias alias laboriosam ducimus consequuntur totam et. Recusandae est beatae enim eum at. Recusandae deleniti id neque dolorem odio et rerum quo dolor.,1993,TV-Y,218,Drama;Thriller;Romance;Mystery;Fantasy;Adventure;Comedy;Horror;Sci-Fi;Action,BTN,
68,Odio earum id nam et accusamus sint nam velit ut.,Natus est in dolorum non. Aliquid autem tempore ratione odio quia fugit placeat nemo. Eum rerum asperiores libero expedita ut non est sapiente. Doloremque ut quasi.,2003,TV-G,246,Fantasy,RWA,
69,Adipisci ullam provident aut non similique.,Omnis ut et molestias ullam porro aperiam molestiae. Eum omnis neque perferendis sint delectus. Rerum eaque non laboriosam eius rerum. Amet voluptates sit est quo.,1947,TV-PG,30,Thriller;Drama;Action;Comedy;Adventure;Fantasy;Sci-Fi,MTQ,
70,Laborum non fugiat aut.,Odit natus rem. Qui explicabo repudiandae aut tempore. Veniam dicta repellat doloribus amet quidem consequatur asperiores odit. Quos iure nihil.,1912,12A,60,Mystery;Fantasy;Action;Comedy;Thriller;Sci-Fi;Adventure;Drama;Horror,ARM,4
71,Rerum aut maiores tenetur qui qui quibusdam voluptatem laboriosam ipsum.,Nisi illo omnis aliquam maxime eveniet. Quas et recusandae. Asperiores iure eum beatae similique officiis necessitatibus nisi praesentium.,1904,PG,205,Action;Adventure;Thriller;Romance,SSD,3
72,Ipsa voluptatem quaerat.,Consequatur aliquid dolor minus sequi aspernatur explicabo quidem ut iste. Soluta nihil expedita rerum ab. Placeat expedita ullam illo tempore non nihil.,2018,TV-Y,236,Action;Drama;Fantasy;Mystery,VUT,
73,Repellat consectetur dolorem esse est inventore.,Sit sint consequatur tenetur. Nulla debitis vel harum. Aut ipsum officiis consequuntur et omnis necessitatibus officiis.,2002,PG-13,287,Comedy;Horror;Adventure,CUW,
74,Sit accusamus placeat eius occaecati dolorum ipsa repellendus.,Consequatur quos voluptatibus cumque laudantium. Quis rem voluptatibus minima facilis laudantium temporibus cum. Accusamus nisi ipsam est. Distinctio repudiandae qui ducimus velit aliquam voluptates voluptas repellat. Et mollitia sapiente qui.,1965,TV-G,70,Adventure;Horror;Drama;Sci-Fi;Thriller;Romance,BEN,
75,A excepturi et alias autem sed quia qui doloribus doloribus.,Vel hic et. Enim accusantium distinctio quisquam voluptatem. Quo eaque laborum quod quas. Magnam itaque dolores quo fugiat vel dicta cupiditate voluptas. Dolorum voluptatem non est enim eum magnam et sed magnam. Illum dolorum distinctio assumenda iste minima.,1926,U/A,140,Drama;Action;Adventure;Mystery;Fantasy;Thriller,FRO,9
76,Accusantium dolores pariatur quia et quidem laudantium.,Sunt dolores minus cumque cum. Alias explicabo a. Nisi non doloribus incidunt architecto voluptatem. Nesciunt ex illo animi et. Ut aliquid voluptate cum qui minima at.,1976,12,117,Adventure;Comedy;Action;Romance;Sci-Fi;Horror;Mystery;Fantasy;Thriller;Drama,REU,4
77,Nihil et distinctio aut suscipit sunt ipsam cupiditate quibusdam odit.,Quasi aspernatur blanditiis. Doloribus harum aperiam eos qui quo voluptas ullam ea. Culpa quidem quis. Atque dolorem illum.,2007,M,80,Comedy;Mystery;Fantasy,GRC,
78,Ratione est veniam dolorem laborum explicabo autem maiores.,Optio et quae minus voluptate nulla saepe officia. Quos dicta sit dolorem ullam ratione fugiat. Non vel qui velit. Nihil minima dolore quo ut hic molestiae eius magni.,2018,TV-Y,124,Action,CCK,
79,Molestiae eius facilis nihil iusto voluptatem velit.,Nobis id est perspiciatis rerum veritatis quia. Iure quis et placeat beatae qui. Corrupti eos reprehenderit voluptas voluptas mollitia dolores quis fuga quas. Est impedit modi architecto similique.,1991,U/A,102,Romance;Adventure,OMN,
80,Officia aut doloremque incidunt tempora qui a.,Commodi omnis consequuntur distinctio modi non. Et rerum aut ipsam mollitia tenetur ut distinctio. Consequatur eaque cum laudantium provident temporibus dolor fugit fuga. Aut magni est consectetur beatae ipsam asperiores quae. Ipsam voluptatem repellat autem fugiat illo ab voluptatem. Sapiente deserunt assumenda omnis sit possimus.,2012,T,280,Adventure;Thriller;Drama;Comedy;Sci-Fi;Fantasy;Mystery;Action;Romance;Horror,PRY,6
81,Dolores at quisquam velit sint ea similique magni occaecati.,Beatae quo consectetur error. Nesciunt aut enim illo voluptate maiores excepturi et sunt. Non aut dolorum repellat accusamus voluptatibus quo vitae deserunt culpa. Aut et aut natus reiciendis minima et expedita ab provident. Placeat accusamus pariatur voluptatem optio quo quidem laudantium.,1923,R18,137,Drama;Fantasy,COM,
82,Dolor quas placeat laudantium et ut libero magni.,Sit sed quaerat et quae debitis amet tempore. Sit voluptatem unde optio quo laborum voluptatibus natus placeat. Aspernatur expedita et unde quod. Vitae voluptatibus eius aliquid quos. Optio quos et neque quo. Assumenda ut inventore.,1904,GP,241,Action;Drama;Mystery,IRQ,3
83,Assumenda harum impedit voluptatem nostrum asperiores sint quia aut.,Veniam aperiam quisquam sit odit est optio nisi. Fugiat excepturi nesciunt explicabo. Molestiae molestias harum molestiae et cum temporibus dicta. Et aut id laboriosam voluptatem.,1952,R16,130,Thriller;Horror;Mystery;Adventure;Action;Fantasy;Romance;Drama,SYR,
84,Dolorem aut beatae voluptas similique dolor tenetur rerum aut.,Aut ut est neque earum. Consequatur labore quibusdam magnam ut. Omnis sint soluta. Ab repellendus occaecati repellat sit labore maxime commodi cum. Optio quia dolorem dolorem et ut sint.,1995,R21,280,Sci-Fi;Action;Horror;Fantasy;Comedy;Thriller;Adventure,LTU,
