Id,Title,Description,ReleaseYear,AgeCertification,Runtime,Genres,ProductionCountry,Seasons
85,Suscipit qui reprehenderit.,Dignissimos aut adipisci. Rerum dolore quis voluptas quod ipsa nam nostrum ut sint. Nesciunt quibusdam rerum exercitationem delectus possimus ex repudiandae.,1903,TV-MA,164,Thriller;Romance;Sci-Fi;Horror,CYM,
86,Quasi ea rerum aut sunt et adipisci totam sunt aut.,Doloribus corrupti eos consequatur omnis nihil similique totam voluptatem. Temporibus quas est inventore optio adipisci amet sit. Nisi optio vel vitae et fugiat quam. Voluptas sed sint ut voluptas est asperiores delectus. Ullam rerum consequatur cumque voluptatem corrupti quia unde aperiam nemo.,1942,R18,170,Romance;Comedy;Horror;Adventure;Mystery;Fantasy,SLB,
87,Adipisci praesentium quisquam itaque eos velit tenetur.,Rerum quam unde ab officia eius dicta odio eveniet. Qui modi fugit molestias aut aut culpa ex est. Dolore ea sint dolor quo aut magni eaque. Quibusdam enim labore numquam sequi et dolor explicabo velit. Autem et est quis rerum et est.,1970,18,168,Horror;Fantasy;Romance;Thriller;Comedy;Drama;Action;Mystery,VEN,
88,Eveniet maxime cumque ipsum expedita numquam eius deleniti voluptatibus sapiente.,Earum aperiam exercitationem enim occaecati eveniet temporibus. Et dolor quasi facere voluptas amet aliquam tempore. Ad consectetur velit aut nihil facere. Vel quam earum voluptatum adipisci doloremque est quidem non.,1996,18,56,Fantasy;Drama;Mystery,ESH,
89,Sapiente laborum vel et officiis dolores qui quia sint.,Enim provident dolorem vero. Voluptatibus ut cum consectetur et vel. Ut corrupti et eius. Quae nam aut voluptatibus voluptatum enim vero dolorum eum. Atque sit dolorem sint non voluptas.,1903,TV-MA,105,Fantasy;Comedy;Action;Romance;Adventure,IDN,6
90,Tempora explicabo voluptatem unde reiciendis sint ea sunt.,Dicta accusantium hic ut voluptas voluptates quis at. Aliquam nisi sed exercitationem consequatur libero neque. Perspiciatis enim similique porro officiis aut vel. Est aut eum dolorem est excepturi unde. Voluptatem tempora dolor voluptatum autem. Voluptatibus tempora doloremque sunt aliquid nesciunt.,1998,PG,238,Mystery;Horror,PAK,
91,Cupiditate odit veritatis.,Et ut exercitationem. Omnis dolores ipsa repudiandae dignissimos quibusdam aut iusto. Quae sed minima ut est aut illo. Repellendus sed voluptatem ipsam debitis quasi tenetur ratione.,2012,6,152,Horror;Drama;Mystery;Thriller;Adventure;Comedy;Fantasy,KIR,
92,Quae error non.,Nulla repellat ducimus est sunt aliquid qui consequatur unde. Et voluptatem quo. Corrupti optio consequuntur qui illum.,1984,TV-Y7,273,Horror;Comedy;Mystery;Drama;Action;Sci-Fi;Romance,GRL,
93,Culpa culpa beatae.,Aut ut eaque vero vitae id sunt et. Inventore nihil corrupti velit atque fuga facere et temporibus eos. Laboriosam commodi in aut velit et aliquam. Odit ipsum eaque et. Laudantium nihil libero vel cupiditate dolorum ad dolore consequuntur recusandae. Fugit harum sed nemo facere tempora autem excepturi soluta.,1929,TV-PG,218,Romance;Comedy,VCT,
94,Id dolorum eos.,Aut iusto delectus odit aut minima doloremque. Id dicta officia. Veniam delectus vitae quia voluptatum. Nemo ipsam provident impedit. Dicta perferendis consequatur modi error consequatur et. Et alias delectus et illo quibusdam.,2002,R,61,Thriller;Action;Drama;Romance;Sci-Fi;Comedy;Fantasy;Horror,TCD,
95,Natus qui a quasi et.,Beatae deserunt nulla illo harum ea unde sit. Dolores et ipsa. Hic ipsum non rerum inventore quia velit cum doloremque maiores. Illo ab non libero.,1919,X18,192,Action;Mystery,GUM,
96,Exercitationem consequatur excepturi deleniti at.,Omnis minima doloribus rem. Ut ut sit maiores velit. Nulla ducimus eaque odio placeat rem.,1988,TV-Y7,245,Thriller;Romance;Mystery;Action;Horror,DMA,
97,Animi quia sunt placeat voluptas pariatur tempore.,Non quaerat sed provident totam nihil ipsam cum velit. Minima nam et modi. Aspernatur unde est voluptatem. Maiores quaerat quis. Explicabo quae maxime vero cum officiis quia eligendi. Aut est veritatis eum recusandae.,1972,E10+,54,Comedy;Drama;Adventure;Thriller;Romance;Horror,ZMB,
98,Ab unde ut est perspiciatis velit quia nemo amet officiis.,Eum consectetur sunt ut sint. Eaque et vel sunt quibusdam cumque. Fugit magnam distinctio sint ipsum ab eos explicabo qui. Alias est velit qui rerum consequatur corrupti temporibus modi ut.,1978,12,197,Mystery;Sci-Fi;Comedy;Thriller;Fantasy;Drama;Romance;Adventure,SPM,
99,Qui modi unde repudiandae officia molestias.,Fugiat et et quo debitis. Id fugiat distinctio occaecati inventore praesentium aut tenetur. Aliquid ratione omnis.,2007,R21,164,Action;Fantasy;Drama;Adventure;Thriller;Comedy,BRA,
100,Distinctio error ullam sed ratione.,Esse sint cupiditate nihil. Et id consequatur. Omnis et occaecati aut sit et. Expedita illum qui illum cupiditate omnis fuga corporis rem ab. Eligendi officiis quia adipisci. Odit deleniti nihil delectus molestias autem culpa.,1920,E10+,222,Comedy;Action;Fantasy;Horror;Mystery,ISL,
101,Ducimus est quasi commodi sed itaque mollitia cumque.,Non deleniti nihil nulla ea sunt at porro libero est. Omnis qui a laborum distinctio sed. Recusandae voluptatem odit fuga dignissimos aut inventore sapiente. Vel dolor doloremque architecto quas est blanditiis voluptatibus at. Sint at exercitationem provident sequi alias iusto aliquid accusantium.,2020,CA,98,Comedy;Adventure;Action;Fantasy;Sci-Fi;Drama;Horror;Thriller,BHS,
102,Ut voluptatem ut aperiam et cum sit.,Voluptate velit in et. Laudantium saepe autem deserunt et consequatur hic sed unde ullam. Repudiandae fugit consequatur.,2009,S,278,Thriller,BLR,
103,Blanditiis ex recusandae et totam animi expedita dolore et veniam.,Perferendis illo eos quam non et aperiam fugit omnis. Officia quae doloremque rem cupiditate quis. Ea ducimus minus sequi iusto praesentium suscipit. Velit sed suscipit architecto.,1975,R21,178,Mystery;Sci-Fi;Comedy;Drama;Fantasy,IDN,
104,Consectetur sunt possimus fugit minus provident.,Quasi vero cum tenetur. Quisquam sit cupiditate est. Sint iusto et ab sit. Qui hic est natus dolore aut. Ut facere amet cum repellendus accusamus sunt et.,1965,X18,33,Fantasy;Drama;Sci-Fi;Mystery;Adventure,CAN,
105,Cumque quo et mollitia quisquam ratione.,Consequatur enim dolores blanditiis et. Sapiente et odit aliquam corporis perspiciatis. Qui itaque odit sunt accusantium perferendis dolores. Nostrum id maxime tempora.,2005,12A,243,Thriller;Sci-Fi;Comedy;Horror;Adventure;Fantasy;Mystery,POL,
106,Ut ut et et aut est provident.,Ipsa et eum dolorem ipsa quia rem fuga nesciunt. Esse molestias quia dolor. Consectetur totam voluptatem maiores itaque at. Sint aspernatur aperiam in omnis corrupti ipsa. Maxime eveniet est. Deserunt et quo est magni officia.,1921,C,125,Sci-Fi;Action;Adventure;Thriller;Horror;Fantasy;Comedy;Drama,GUF,
107,Odio sit corrupti autem quidem laboriosam.,Tempora sed hic et est rerum. Facilis commodi qui id quos. Ut culpa aut esse ea est. Incidunt sunt sit repellat.,1986,MA15+,179,Mystery;Horror;Fantasy;Romance;Comedy;Sci-Fi;Adventure;Action;Drama,MRT,
108,Qui debitis quaerat.,Blanditiis animi explicabo. Quam exercitationem magnam. Dicta ut itaque ipsum.,1988,TV-MA,50,Romance;Drama;Fantasy;Thriller;Adventure;Horror;Comedy,SYR,
109,Sunt eligendi et est nam nemo ducimus voluptas.,In non animi quas iusto. Quidem sed similique corporis molestias. Nisi consequatur voluptate non repudiandae ipsa. Soluta ipsam possimus blanditiis porro esse facere. Aliquam modi beatae expedita perferendis molestiae totam autem. Fuga maiores et veniam maxime.,1949,9,284,Comedy;Mystery;Romance;Action;Fantasy;Adventure;Sci-Fi;Horror,QAT,
110,Quia et nobis.,Autem corrupti labore quia et eos. Autem voluptatum quasi dolorem doloremque ducimus ea quas iste deleniti. Vel ut perspiciatis repudiandae unde. Quis magnam ad incidunt blanditiis natus. Vitae repudiandae reiciendis esse. In itaque accusamus.,1990,NC-17,104,Adventure;Sci-Fi;Action;Horror,SWZ,
111,Dolore aut eligendi autem modi nesciunt culpa sed ut non.,Optio expedita ea sit. Quo suscipit ut et velit facilis eos. Harum placeat et nesciunt officiis cumque. Dolore delectus blanditiis mollitia. Voluptas ab sit repellendus perspiciatis ullam. Error adipisci aspernatur iste ipsam non harum dolores.,1955,X18,239,Adventure;Drama,GUM,7
112,Sint natus et nam deserunt.,Sit qui sunt. Non assumenda harum aliquam quae. Consequatur voluptates nemo beatae dignissimos sit nostrum odio. Iure consequatur quibusdam ut sint. Nihil quos quam quo at expedita. Similique sit nesciunt.,1910,TV-G,118,Comedy;Sci-Fi;Fantasy,SSD,
113,Harum quibusdam tempora reprehenderit qui fugit ut itaque cumque.,In voluptatem non amet aut vero sunt magnam. Saepe autem eveniet ea suscipit quo optio. Minima modi repudiandae eos fugiat est earum magnam modi. Cum saepe sint amet sint.,1951,TV-MA,256,Romance;Thriller;Comedy;Action;Adventure;Sci-Fi;Mystery;Drama;Fantasy;Horror,BDI,
114,Reprehenderit veniam qui laboriosam.,Rerum pariatur accusantium harum nesciunt nostrum repellat qui corrupti. Voluptatem et ipsam vitae molestiae. Et adipisci ipsum qui et quos. Ut qui placeat totam sed ut voluptates rem. Est culpa voluptatem ad quia consequatur.,1915,15,154,Mystery;Thriller;Drama;Romance;Sci-Fi;Adventure;Comedy;Fantasy;Horror;Action,JPN,
115,Optio voluptates porro facere quia quis rerum et eos ipsam.,Omnis facere minus voluptas nulla recusandae repellendus quia itaque. Delectus eum a sit nulla ex aut ex at quibusdam. Et error et.,1946,M/PG,286,Comedy;Romance;Horror;Action;Drama,BDI,
116,Omnis autem quod explicabo.,Iste natus cumque voluptates autem. Eum numquam saepe incidunt voluptate molestiae omnis. Ut velit placeat in omnis consequatur doloremque quia laboriosam. Quae voluptas sed et voluptatem aspernatur et velit aut. Placeat et omnis libero repudiandae enim aliquid est et optio. Commodi aut ex nostrum magni ut tempora quaerat esse enim.,2011,TV-Y7,200,Comedy;Adventure;Mystery;Horror,HMD,3
117,Sunt harum dolorum dicta in eos mollitia consequatur id.,Aut ut voluptas. Distinctio dolores ullam quo accusantium. Illo at vel enim voluptas vel quisquam dolores fuga sint. Fuga nisi a non.,1965,E10+,287,Drama;Action;Sci-Fi;Mystery,BVT,
118,Veniam sit laudantium at dolor maiores eligendi sed numquam quae.,Ex et optio sapiente delectus facilis veritatis fugiat soluta et. Ratione at ipsum. Ducimus impedit accusantium exercitationem illum. Aut voluptas vitae. Perferendis mollitia ut. A at dicta modi id quia.,2000,M,286,Drama;Romance;Comedy;Horror;Sci-Fi,AFG,
119,Magnam et consequatur et accusamus nobis.,Harum omnis alias. Culpa sit molestiae animi praesentium magni ab soluta at temporibus. Animi et in itaque eos necessitatibus sunt nostrum ut. Aliquid vero soluta velit enim enim soluta aut illo. Omnis dolore in quae hic repudiandae nesciunt quia doloremque eos. Cupiditate consectetur veniam molestiae vitae officia ea sequi.,1911,NC-17,87,Comedy;Adventure,BHS,
120,Culpa dolor nam dolor non quo.,Perferendis suscipit accusamus. Aut quo tempora cum et velit architecto. Consequatur dolorem expedita hic laborum deserunt laudantium. Unde facere aliquid voluptatem sit eligendi repudiandae inventore. Omnis unde dolor. Veniam sit ipsum molestiae.,1990,E,52,Comedy;Fantasy;Adventure;Horror;Mystery;Sci-Fi;Romance;Drama,VIR,
121,Non beatae quas aspernatur aliquam quod praesentium et.,Unde qui alias et veniam. Hic odio non suscipit ab ex inventore. Quos nemo tempora. Perspiciatis consequuntur aut et fuga et reprehenderit perspiciatis a. Ut amet totam atque numquam qui cumque non.,2001,PG,141,Comedy;Thriller;Fantasy;Sci-Fi;Action;Romance;Drama;Adventure;Horror,URY,
122,Veritatis quasi consequuntur veritatis quasi nihil maiores qui consequatur.,At omnis blanditiis et odit doloribus dolores voluptatum. Ut quod autem a aut sequi deserunt. Est officiis in et sint aut saepe saepe similique non.,2011,TV-Y7,137,Comedy;Horror;Drama;Thriller;Mystery;Action;Romance;Fantasy,ZMB,3
123,Facilis sed possimus.,Ut omnis corrupti ex modi provident ea at officiis laboriosam. Et rerum quia. Delectus odio culpa non ullam aperiam voluptas a. Sit vel recusandae expedita natus quidem blanditiis a eum a. Sit neque hic suscipit consequatur animi facere sequi eos provident.,2021,R18,38,Thriller;Drama;Sci-Fi,GLP,6
124,Facere distinctio minus accusamus nam ut ipsam omnis rerum et.,Perferendis commodi eos alias sapiente sequi aut accusamus. Cumque doloremque et magni. Sunt pariatur illum expedita quae quibusdam eos ut enim qui. Impedit voluptatem magnam.,1919,TV-Y,35,Fantasy;Sci-Fi;Drama;Comedy;Action;Mystery;Thriller;Romance,LCA,
125,Et distinctio excepturi aspernatur laboriosam expedita deleniti voluptate commodi.,Blanditiis perspiciatis suscipit expedita. Sed quia iusto aut quis odit incidunt. Aut consequatur voluptatem et quia debitis ut.,1914,TV-Y,276,Action;Comedy;Mystery,TCA,
126,Exercitationem et quos illo veritatis natus sunt ducimus nihil.,Nobis nesciunt autem consequuntur laudantium aperiam dolor aut natus. Quia dolores dicta sit molestias soluta harum non ea eius. Officia sed aut neque consequatur et alias saepe inventore quo. Impedit quis quia totam iure voluptate autem nam laudantium. Nemo dicta doloremque omnis.,1961,TV-G,261,Fantasy;Drama;Adventure;Thriller;Romance;Horror;Sci-Fi;Comedy,CXR,
127,Fugit asperiores ducimus et ratione vitae sit sit odio est.,Non temporibus atque aut qui labore est soluta rerum sequi. Voluptatem aperiam molestiae quaerat. Aspernatur molestiae id amet numquam quia.,1984,C,120,Drama;Romance;Comedy;Horror;Sci-Fi;Adventure;Thriller;Fantasy,VNM,9
128,Ipsam in maiores maxime qui.,Ad sapiente fugit itaque consequatur necessitatibus ipsum. Dolores qui rerum dolor est ea incidunt. Pariatur et delectus vel natus repudiandae ipsum. Ab et dolor asperiores consequuntur voluptatem dolores quisquam reprehenderit a.,1974,TV-MA,131,Horror;Fantasy;Action;Sci-Fi;Romance,GUF,2
129,Quas suscipit mollitia vero consequatur autem ut voluptas.,Aut aspernatur consequatur vitae aut voluptas error assumenda. Ut error impedit quia voluptate. Quas consequatur aut. Eos ut saepe ea minus quo necessitatibus ut quisquam ipsam. Accusantium nemo impedit quis ut.,1978,G,42,Action;Sci-Fi;Fantasy;Mystery;Romance;Thriller,LBN,4
130,Voluptates quo ratione consequatur iusto aliquid non explicabo reiciendis blanditiis.,Aperiam dicta minima praesentium sed voluptas molestiae nobis quam corrupti. Voluptas ducimus ut itaque recusandae. Possimus quos eius tempore quia ipsa.,1906,M/PG,127,Fantasy;Action;Sci-Fi;Horror;Mystery;Adventure;Drama,GUF,
131,Quia sit ut quia culpa deserunt.,Voluptatem impedit eligendi magnam voluptates velit blanditiis aut repudiandae sed. Impedit beatae sed consectetur dolores sunt ipsum. Est impedit deserunt.,1907,18,289,Drama;Mystery;Fantasy,BDI,
132,Et cumque necessitatibus et aliquid error tempora labore earum.,Officia recusandae inventore sequi vero. Quos at consectetur ad atque. Quibusdam nam vitae doloribus ut non neque quos. Consequatur tempora asperiores aspernatur. Eveniet soluta voluptatem doloremque nam vitae sint.,1920,E,226,Comedy;Thriller;Sci-Fi;Action;Adventure,NIU,1
133,Dolorum impedit rerum.,Quia et nostrum quod. Voluptas optio maiores quidem perspiciatis autem labore quo quis. Qui illo sint id delectus et sunt. Excepturi quia deserunt odio sint.,2001,TV-Y7,101,Sci-Fi;Mystery;Comedy,SPM,
134,Consequatur sunt porro et deleniti omnis.,Amet a placeat aut ut doloremque ut. Deleniti aut ex quia illum aut repudiandae rerum laboriosam sapiente. Sed est adipisci et doloribus eum dolor. Ullam voluptates nihil ut suscipit quibusdam illum cupiditate et quia. Rerum reprehenderit omnis quia vero reprehenderit in. Praesentium provident alias qui adipisci ea.,1901,EC,173,Action,PER,
135,Laboriosam molestias explicabo.,Incidunt aut aut dolores eos molestiae consequatur. Non in qui. Sed omnis ut quia voluptatibus numquam repellendus corrupti nihil. Est nostrum possimus in molestias aliquid modi ut. Modi quia in fugit quo est omnis iusto. Dolorem repellendus consequatur aut ex.,1923,CA,69,Action;Sci-Fi;Horror;Fantasy,GNB,
136,Debitis laborum dolorem eveniet dicta quod harum porro dolor.,Hic temporibus ut distinctio minima harum dicta. Est odit sed impedit ullam similique ex sunt mollitia. Vel ea qui doloribus deserunt facere ex minima est quia.,1967,U/A,51,Horror;Mystery;Drama;Comedy;Action,BIH,
137,Sapiente expedita ea excepturi repellendus necessitatibus explicabo itaque consectetur sunt.,Harum ad odio sint facilis porro eos velit. Odio iusto eveniet consequatur in earum officia totam. Laborum enim dignissimos suscipit adipisci.,1950,R16,220,Thriller;Sci-Fi;Fantasy;Mystery;Drama;Horror;Comedy;Adventure,PRK,
138,Dolorem fugiat omnis sunt ut.,Nam vel neque est. Sint qui ex. Quis est qui accusamus et repellat ut nemo. Maiores inventore minima.,2014,TV-MA,189,Adventure;Romance;Fantasy;Mystery;Action;Drama;Sci-Fi,MNE,
139,Et ut consectetur dolores sit perferendis officiis eligendi sed.,Maxime pariatur ipsa quas exercitationem asperiores eos cupiditate. Fuga et ipsum deserunt praesentium. Et provident maxime consequuntur. Id quia dicta nemo et sint. Voluptates excepturi quae dolorum neque eos eaque placeat.,1976,GP,193,Action;Thriller;Horror;Adventure;Sci-Fi;Mystery;Romance,TUR,
140,Aperiam doloribus quo eveniet omnis facilis.,Distinctio voluptates possimus id adipisci occaecati nisi. Alias accusantium qui optio. Voluptatum sint vel veniam.,1956,TV-G,76,Sci-Fi;Comedy;Mystery;Drama;Action,ALA,
141,Assumenda occaecati nemo aliquam laborum repellendus molestias ut.,Ut sequi velit quo. Repudiandae facere fugiat id animi in quis tempore impedit. Quia ut repellendus qui deserunt modi numquam consequatur mollitia voluptatem. Voluptas est voluptas ratione veritatis nobis vero dolorum maiores ipsam.,1962,R18+,234,Drama;Thriller;Mystery;Fantasy;Sci-Fi;Horror,PNG,
142,Molestias voluptas sequi est error qui dicta.,In autem provident rerum id quia consequatur suscipit. Eligendi quos veniam odit. Velit at doloremque porro enim ad quia officiis voluptatem sequi. Officiis ab non voluptatem minima voluptatibus cumque et est autem. Qui aut et.,1900,AL,194,Thriller;Romance;Horror;Drama;Action;Comedy;Sci-Fi;Fantasy,PRT,
143,Porro in consequatur eum laudantium facilis.,Non omnis earum et dolor facere eius. Et est architecto veritatis architecto amet saepe similique. Modi sint cum vero explicabo tenetur. Autem repellat qui qui sit voluptas.,1959,6,209,Thriller;Sci-Fi;Romance;Adventure;Mystery;Action;Horror,SSD,
144,Quisquam aut autem quidem itaque accusamus illum in optio.,At mollitia vel. Sint et itaque maiores dolores vel cum voluptatem nulla quia. Dolor ullam et voluptatem corporis id. Et optio dignissimos rerum.,1952,18,150,Thriller;Drama;Mystery;Sci-Fi;Romance;Comedy;Action;Horror;Adventure;Fantasy,BOL,1
145,Atque distinctio ut aut amet.,Quis dolores non ut. Soluta eaque ut ipsum asperiores molestiae. Velit est sint et suscipit tempore sit ducimus enim modi.,1994,E,168,Horror;Mystery;Drama;Comedy;Sci-Fi;Romance,AUT,6
146,Non quia sunt ad aut voluptatem sunt.,Delectus eos cum. Ipsam in unde neque fugiat. Odit repudiandae sint explicabo ipsa quidem. Praesentium nihil non dolor placeat consequatur. Aperiam officia facilis doloribus.,1911,S,88,Horror;Adventure;Drama;Thriller;Mystery;Fantasy;Action,HRV,
147,Aut nemo cupiditate sed nam quia.,Odit autem vitae. Dignissimos ut vel et autem quidem est cumque et. Eveniet et tempora rerum asperiores ipsam. Ut aut autem et asperiores et quis ipsum.,1908,R21,129,Adventure;Romance;Comedy;Thriller;Horror;Fantasy;Mystery;Action;Sci-Fi,UMI,
148,Nobis fugit ad qui non expedita.,Voluptate et iure est sit repellat ex culpa qui. Debitis omnis ut aut. Repudiandae quia maxime molestiae officia dolorem perferendis. Iure facilis magnam ea nisi deserunt atque quos temporibus rerum.,2013,R21,57,Drama;Fantasy;Sci-Fi,VGB,
149,Animi reiciendis rem qui iure recusandae.,Et dolores voluptatibus. Quia architecto saepe a quibusdam minima voluptatibus repudiandae eius. Ad voluptatum dolor vel qui eum rerum ut officia.,1907,S,64,Thriller;Horror;Adventure;Comedy;Fantasy,MNP,
150,Provident dolorem ab eius et asperiores velit aut eos.,Et quibusdam quia illo voluptates autem occaecati quia nemo. Aut similique distinctio. Assumenda aut error excepturi aut quod at voluptatem excepturi.,1999,9,76,Romance;Comedy;Thriller;Horror;Drama;Adventure,SOM,
